{
  "skill": "qveris-a-share-data",
  "source_record": {
    "candidate_number": 57,
    "original_repository": "A-Share Skill",
    "github_url": "https://github.com/shouldnotappearcalm/a-share-skill",
    "license": "MIT",
    "evaluation_recent_activity": "2026-06-24",
    "local_source_snapshot": "third_party/source_repos/57-a-share-skill",
    "snapshot_latest_commit": "8494623 on 2026-06-24"
  },
  "controls": {
    "dry_run": false,
    "max_calls": 7,
    "max_age": "P1D",
    "budget_note": "single-security A-share data read"
  },
  "analysis": {
    "summary": "Symbol, quote, and bars are QVeris-validated; technical context is calculated from validated bars only.",
    "technical_context": {
      "status": "complete",
      "calculated_from": "qveris_finance.mkt_bars_adjusted"
    }
  },
  "risk_notes": [
    "Technical indicators are descriptive and not trade triggers.",
    "Trading and paper-trading modules from the source repo are removed."
  ],
  "missing_fields": [
    "sector_heatmap",
    "a_h_mapping",
    "hk_ipo_timeline",
    "strong_sentiment_score"
  ],
  "data_quality": {
    "status": "partial",
    "warnings": [
      "specialty_routes_require_current_cap_detail"
    ],
    "stale_fields": [],
    "out_of_window_events": [],
    "suppressed_fields": [
      "paper_trading",
      "entry_exit_trigger",
      "position_size",
      "stop_loss",
      "buy_sell"
    ]
  },
  "qveris_trace": [
    {
      "tool_name": "qveris_finance.ref_symbology",
      "capability_id": "qveris_finance.ref_symbology",
      "entity": "300750",
      "market": "CN",
      "params": {"symbol": "300750", "market": "CN"},
      "as_of": "2026-07-08",
      "retrieved_at": "2026-07-08T10:40:00+08:00",
      "fallback_used": false,
      "missing_fields": [],
      "quality_note": "identity_validated"
    },
    {
      "tool_name": "qveris_finance.mkt_bars_adjusted",
      "capability_id": "qveris_finance.mkt_bars_adjusted",
      "entity": "300750",
      "market": "CN",
      "params": {"symbol": "300750", "frequency": "1d", "count": 120},
      "as_of": "2026-07-08",
      "retrieved_at": "2026-07-08T10:40:04+08:00",
      "fallback_used": false,
      "missing_fields": [],
      "quality_note": "indicator_inputs_validated"
    }
  ],
  "disclaimer": "Not investment advice.",
  "suppressed_fields": [
    "paper_trading",
    "entry_exit_trigger",
    "position_size",
    "stop_loss",
    "buy_sell"
  ]
}
