{
  "skill": "qveris-a-stock-data-layer",
  "source_record": {
    "candidate_number": 58,
    "original_repository": "A-Stock Data",
    "github_url": "https://github.com/simonlin1212/a-stock-data",
    "license": "Apache-2.0",
    "evaluation_recent_activity": "2026-06-28",
    "local_source_snapshot": "third_party/source_repos/58-a-stock-data",
    "snapshot_latest_commit": "bcda405 on 2026-06-28"
  },
  "controls": {
    "dry_run": false,
    "max_calls": 6,
    "max_age": "P1D",
    "budget_note": "standard data-layer read"
  },
  "analysis": {
    "summary": "Issuer, quote, bars, and research context are QVeris-validated; specialty A-share layers remain missing unless current cap-detail confirms them.",
    "layers": [
      {"name": "market_data", "status": "complete"},
      {"name": "research", "status": "partial"},
      {"name": "specialty_a_share", "status": "insufficient"}
    ]
  },
  "risk_notes": [
    "Top movers cannot substitute for capital-flow or limit-board evidence.",
    "Research recommendations and price-objective fields are suppressed."
  ],
  "missing_fields": [
    "lhb_records",
    "unlock_calendar",
    "capital_flow_minute",
    "limit_board_pool",
    "etf_option_greeks",
    "investor_qa"
  ],
  "data_quality": {
    "status": "partial",
    "warnings": [
      "specialty_routes_require_current_cap_detail"
    ],
    "stale_fields": [],
    "out_of_window_events": [],
    "suppressed_fields": [
      "target_price",
      "rating",
      "upside_downside",
      "buy_sell",
      "execution_plan"
    ]
  },
  "qveris_trace": [
    {
      "tool_name": "qveris_finance.ref_symbology",
      "capability_id": "qveris_finance.ref_symbology",
      "entity": "600519",
      "market": "CN",
      "params": {"symbol": "600519", "market": "CN"},
      "as_of": "2026-07-08",
      "retrieved_at": "2026-07-08T10:00:00+08:00",
      "fallback_used": false,
      "missing_fields": [],
      "quality_note": "identity_validated"
    },
    {
      "tool_name": "qveris_finance.mkt_bars_adjusted",
      "capability_id": "qveris_finance.mkt_bars_adjusted",
      "entity": "600519",
      "market": "CN",
      "params": {"symbol": "600519", "start_date": "2026-06-08", "end_date": "2026-07-08"},
      "as_of": "2026-07-08",
      "retrieved_at": "2026-07-08T10:00:03+08:00",
      "fallback_used": false,
      "missing_fields": [],
      "quality_note": "window_validated"
    }
  ],
  "disclaimer": "Not investment advice.",
  "suppressed_fields": [
    "target_price",
    "rating",
    "upside_downside",
    "buy_sell",
    "execution_plan"
  ]
}
